{
  "summary": {
    "faithfulness": 0.9731481481481482,
    "answer_relevancy": 0.9410929166073358,
    "context_precision": 0.9149074073812972,
    "context_recall": 1.0
  },
  "per_question": [
    {
      "user_input": "Can a trustee be removed from the trust?",
      "retrieved_contexts": [
        "resignation of any of the Trustees, may be filled up by co-option by the Board of Trustees.\nThe Trustees who are not First Managing Trustee or First Trustees shall hold office for a period\nof one year from their date of appointment by the Trustees. At the end of this one year period,\nthe Board of Trustees may reappoint them for subsequent term or appoint other persons as\nTrustees in such a manner that the total number of Trustees does not exceed the approved\nmaximum number of Trustees.\nThe Managing Trustee shall have the power to remove a Trustee suffering from physical or\nmental disability or if he is accused of misfeasance of trust funds or property or misconduct,\nafter satisfying himself on enquiry and such action of the Managing Trustee shall be final.",
        "33\nManaging Trustee shall have all the residuary powers, not explicitly assigned to any of\nthe other officers in these presents. The Managing Trustee is authorized to sign along\nwith the Treasurer, bank cheques, deposit release vouchers etc. The Managing Trustee\nis empowered to remove any Trustee from the Trust and its offices, if he finds that\nhis/her activities are not congenial to the activities of the Trust. The Managing Trustee is\nresponsible for ensuring that the Trust pursues its Objects and for maintaining the dignity\nof the Trust organization and shall use his influence to promote the activities of the Trust.\n(b) Vice President \u2013\nThe Vice President shall discharge the duties of the Managing Trustee, in the",
        "31\nThe term of office of First Trustees shall be for their respective lives. The Board of Trustees\nshall have the power to increase the total number of Trustees upto the maximum number stated\nabove and fix their term as per provisions contained herein.\nAny Trustee, including the Managing Trustee may retire from the Trusteeship hereof by giving\ntwo months notice in writing of his or her intention to do so, to the Board of Trustees and after\nthe expiry of the period of notice, the Trustee shall cease to be a Trustee of these presents.\nAny vacancy caused by death of any one of the First Trustees, or any vacancy caused by the\nresignation of any of the Trustees, may be filled up by co-option by the Board of Trustees.",
        "manner and to hold the same upon Trust for the objects set forth herein.\n(k) To appoint, suspend, dismiss or otherwise deal with the staff required for the\nadministration of the Trust, to frame rules relating to their salaries and other benefits\nand generally to exercise all powers ancillary and incidental to effectively carry out\nthe objects of the Trust.\n(l) The Board shall have power to make and rescind rules and regulations for the\nmanagement and administration of the Trust.\n(m) No Trustee shall commit any act or breach of Trust of the Trust fund or property or\ncause any loss to the Trust property or commit fraud in the administration of the Trust\nfund / property.\n(n) The Trustees shall hold honorary office and shall not be entitled to any Salary,",
        "expenses incurred in the upkeep or management thereof.\n(d)That the trustees shall receive and hold the income of the trust on behalf of and for the\nbenefit of the beneficiaries under the trust.\n9. Number of Trustees and their Term:\nThe Trust will be managed by a Board of Trustees consisting of not less than 2 trustees\nand not more than 9 trustees. The parties of the Other Part will be First Trustees and they shall\nautomatically form the Board of Trustees.\nThe first Managing Trustee shall be the SETTLOR and he will hold office for his life time. After\nthe demise or relinquishment of office of the Managing Trustee or in the event of the first\nManaging Trustee failing to nominate his successor in office, the remaining trustees shall elect\none of the other Trustees as Managing Trustee."
      ],
      "response": "Yes, a trustee can be removed from the trust.\n\nThe Managing Trustee has the power to remove a Trustee if they are:\n*   Suffering from physical or mental disability.\n*   Accused of misfeasance of trust funds or property.\n*   Accused of misconduct.\n*   If their activities are not congenial to the activities of the Trust.",
      "reference": "Yes, a Managing Trustee has the power to remove a trustee for misfeasance, misconduct, or physical or mental disability, after conducting an inquiry.",
      "faithfulness": 1.0,
      "answer_relevancy": 0.99995719265011,
      "context_precision": 0.9166666666361111,
      "context_recall": 1.0
    },
    {
      "user_input": "What are the tenant's obligations regarding the property condition?",
      "retrieved_contexts": [
        "(d) To keep the furniture clean and in good repair order and preservation and to make good\nthe damages thereto;\n(e) To allow the landlord and his agents at all reasonable times to enter upon and examine\nthe condition of the dwelling house and the furniture;\n(f) If the landlord finds that any repair is necessary to the dwelling house and/or furniture,\nhe shall serve upon the tenant a notice in writing to carry out the repairs in the dwelling\nhouse or furniture and the tenant shall carry out the repairs within one month after the\nservice of such a notice;\n(g) To insure the dwelling house and furniture against loss or damage by fire with an\ninsurance company approved in writing by lessor for an amount which shall not be less",
        "the Landlord.\n5. If for by any reason the tenant occupies the building for a period that includes part of a\nmonth, it is agreed that the rent will be charged on a pro-rated basis for that month.\n6. The landlord shall pay all existing and future taxes, rates and assessments in respect of the\nlease hold including the municipal or other tax assessed by a local authority on the value of\nthe building or annual letting value of the building and all other rates, taxes and\nassessments levied by any authority whatsoever.\n7. The tenant shall pay the electricity and water supply charges for the period of time he\noccupies the premises.\n8. The tenant agrees to leave at the end of tenancy the premises in good condition as theyare\nnow, subject to reasonable wear and tear.",
        "8. The tenant agrees to leave at the end of tenancy the premises in good condition as theyare\nnow, subject to reasonable wear and tear.\n9. The tenant also agrees not to let out the building or a portion of it to anybody else.\n10. The tenant shall not commit any act of waste in the premises.\n11. The tenant also agrees to pay any maintenance on the building as mutually agreed upon by\nthe tenant and the landlord and the said expenses shall be adjusted against the rent amount\ndue to the landlord.\n12. It is hereby agreed that the tenant paying the rent hereby reserved, and performing and\nobserving each of the covenants herein contained, may peacefully hold and enjoy the said\nbuilding during the lease period without any interruption by the landlord.",
        "fees, maintenance charges, electricity charges, corporation taxes and all other sums of moneys\nreceivable in respect of my properties and to make all just and reasonable allowance therein in\nrespect of rates, taxes, repairs and other outgoings and to take all necessary steps whether by\naction, distress or otherwise to recover any property or sums of money in arrears.\n2.4. To pay outgoings:- To pay all taxes, rates, assessments, charges, expenses and\nother outgoings whatsoever payable for or on account of my properties or any part thereof and\nto insure any buildings thereon against loss or damage by fire and other risks as be deemed\nnecessary and/or desirable and to pay all premia for such insurances.\n2.5. To serve notice on tenants:- To sign and give any notice to any occupier of any",
        "2.5. To serve notice on tenants:- To sign and give any notice to any occupier of any\nproperty belonging to me to quit or to repair or to abate any nuisance or to remedy any breach\nof covenant or for any other purpose whatsoever.\n2.6. To construct, repair and/or reconstruct:- To take down, demolish, rebuild and/or\nrepair any of my house, building or other structure of whatever nature.\n2.7. To get utilities: - To apply for and obtain electricity, gas, water, sewerage and/or\nconnections of any utilities and/or to make alterations and/or close down and/or have\ndisconnected the same in my properties.\n2.8. To view the condition of any property:- To enter upon any of my property or any part\nof it as often as be desired to view the state of repair thereof and to require any occupier as a"
      ],
      "response": "The tenant's obligations regarding the property condition are:\n*   To keep the furniture clean, in good repair, and make good any damages to it.\n*   To carry out repairs to the dwelling house or furniture within one month after receiving a written notice from the landlord.\n*   To leave the premises in good condition at the end of the tenancy, subject to reasonable wear and tear.\n*   Not to commit any act of waste in the premises.\n*   To pay any maintenance on the building as mutually agreed upon by the tenant and the landlord.",
      "reference": "The tenant agrees to leave the premises at the end of tenancy in good condition as they are now, subject to reasonable wear and tear. The tenant shall not commit any act of waste in the premises.",
      "faithfulness": 1.0,
      "answer_relevancy": 0.9999737683643531,
      "context_precision": 0.5833333333041666,
      "context_recall": 1.0
    },
    {
      "user_input": "Can the tenant sublet the building?",
      "retrieved_contexts": [
        "building during the lease period without any interruption by the landlord.\n13. The agreement does not cover the property adjoining the premises and the landlord shall be\nfree to take the yield from the property to effect improvements therein and the tenant shall\nnot cause any obstruction for the same.",
        "15\nCOMMERCIAL LEASE DEED\nAgreement made on this ________ day of \u2026\u2026\u2026\u2026\u2026\u2026\u2026\u2026, 20\u2026\u2026..\nBetween\n_______, ________ (hereinafter referred to as LANDLORD) of the one part\nAnd\n______, resident of _______ (hereinafter referred to as TENANT) of the other part.\nWHERE IT IS AGREED AND DECLARED AS FOLLOWS:\n1. The Landlord agrees to let out and the tenant agrees to take on rent the ground floor portion\nof the building ___________ for his office along with electrical and sanitary fittings and other\naccessories fittings and structures (hereinafter called the PREMISES) from ________ at the\nmonthly rent of _______ being payable on or before 5th of every month to the Landlord. The\nperiod of this agreement shall be for twenty four months with effect from _______ .",
        "21\nNOW THIS AGREEMENT TO LEAVE AND LICENCE WITNESSETH AND IT IS HEREBY\nAGREED BY AND THE PARTIES HERETO as under: -\n1. The Licensors shall grant unto the Licensee and the Licensee hereby accepts from the\nLicensors a licence to use and occupy the office premises bearing No. ____ on the ____\nfloor of the building known as ____________ , save and except one cabin in the said\npremises (hereinafter called \"the licensed premises\") situate lying and being at\n(____________ road) on leave and license basis.\n2. The duration of the licence hereby granted shall be for a period of two years only\ncommencing from the date the Licensors puts the Licensee in possession of the licensed\npremises.\n3. In consideration of the Licensors permitting the Licensee to use and occupy the licensed",
        "the Landlord.\n5. If for by any reason the tenant occupies the building for a period that includes part of a\nmonth, it is agreed that the rent will be charged on a pro-rated basis for that month.\n6. The landlord shall pay all existing and future taxes, rates and assessments in respect of the\nlease hold including the municipal or other tax assessed by a local authority on the value of\nthe building or annual letting value of the building and all other rates, taxes and\nassessments levied by any authority whatsoever.\n7. The tenant shall pay the electricity and water supply charges for the period of time he\noccupies the premises.\n8. The tenant agrees to leave at the end of tenancy the premises in good condition as theyare\nnow, subject to reasonable wear and tear.",
        "8. The tenant agrees to leave at the end of tenancy the premises in good condition as theyare\nnow, subject to reasonable wear and tear.\n9. The tenant also agrees not to let out the building or a portion of it to anybody else.\n10. The tenant shall not commit any act of waste in the premises.\n11. The tenant also agrees to pay any maintenance on the building as mutually agreed upon by\nthe tenant and the landlord and the said expenses shall be adjusted against the rent amount\ndue to the landlord.\n12. It is hereby agreed that the tenant paying the rent hereby reserved, and performing and\nobserving each of the covenants herein contained, may peacefully hold and enjoy the said\nbuilding during the lease period without any interruption by the landlord."
      ],
      "response": "No, the tenant cannot sublet the building or a portion of it to anybody else. Clause 9 states: \"The tenant also agrees not to let out the building or a portion of it to anybody else.\"",
      "reference": "No, the tenant agrees not to let out the building or a portion of it to anybody else.",
      "faithfulness": 1.0,
      "answer_relevancy": 0.9649325156020555,
      "context_precision": 0.99999999998,
      "context_recall": 1.0
    },
    {
      "user_input": "What does the donor covenant regarding the granted property?",
      "retrieved_contexts": [
        "5\n2. GIFT:\nAccording to Sec.122 of The Transfer of Property Act, 1882, \u201cGift is the transfer of\ncertain existing moveable or immoveable property made voluntarily and without consideration,\nby one person, called the donor, to another, called the donee, and accepted by or on behalf of\nthe donee.\u201d\nDEED OF GIFT OF IMMOVABLE PROPERTY\nTHIS DEED OF GIFT is made at ........ this ........ day of \u2026\u2026\u2026.......\nBetween\nMr.\u2026\u2026\u2026\u2026s/o \u2026\u2026\u2026\u2026... of ....... hereinafter referred to as 'the DONOR' of the One Part\nAnd\nMr. \u2026\u2026\u2026\u2026. s/o\u2026\u2026\u2026..of ....... hereinafter referred to as 'the DONEE', of the Other Part.\nWHEREAS the DONOR is seized and possessed of the land and premises situated at\n......... and more particularly described in the Schedule hereunder written.\nAND WHEREAS the DONEE is related to the Donor as ........",
        "hereafter chargeable thereon to the Government or Municipality or other Local Authority.\nAND he the DONOR doth hereby covenants with the DONEE:\n(a) That the DONOR now has in himself, good right, full power and absolute authority to grant\nthe said piece of land and other the premises hereby granted as gift in the manner\naforesaid.\n(b) The DONEE may at all times hereafter peaceably and quietly enter upon have occupy,\npossess and enjoy the said piece of land and premises and receive the rents, issues and\nprofits and rents thereof and every part thereof to and for his own use and benefit without\nany suit, lawful eviction, interruption, claim or demand whatsoever from or by the DONOR",
        "hereby grant and transfer by way of gift the said land and premises situated at \u2026\u2026\u2026\u2026\u2026.......\nand more particularly described in the Schedule hereunder written together with all the\nbuildings, and structures thereon and all the things permanently attached thereto or standing\nthereon and all the liberties, privileges casements and advantages appurtenant thereto and all\nthe estate, right, title, interest use, inheritance, possession, benefit, claims and demand\nwhatsoever of the DONOR To Have And To Hold the same unto and to the use of the DONEE\nabsolutely but subject to the payment of all taxes, rates, assessments, dues and duties now and\nhereafter chargeable thereon to the Government or Municipality or other Local Authority.\nAND he the DONOR doth hereby covenants with the DONEE:",
        "7\nThis is neither an assigned nor a Government land. The market value of the property is\nRs\u2026\u2026\u2026\u2026\u2026\u2026. (Rupees\u2026\u2026\u2026\u2026\u2026\u2026\u2026\u2026\u2026\u2026\u2026\u2026\u2026\u2026\u2026\u2026\u2026\u2026\u2026\u2026\u2026\u2026\u2026\u2026\u2026\u2026.) only\nIN WITNESS WHEREOF the Donor as well as the DONEE (by way of acceptance of the\nsaid gift) have put their respective hands the day and year first hereinabove written.\nSigned and Delivered by the within named Donor........\nSigned by within named DONEE........\nWitnesses\n1.\n2.\n3. MORTGAGE:\nMortgage is a transfer of an interest in a specific immovable property for the purpose of\nsecuring the payment of money advanced or to be advanced by way of loan, an existing or\nfuture debt or the performance of an agreement, which may give rise to a pecuniary liability.\nThe person borrowing and transferring his interest in an immovable property to the lender is the",
        "6\nor his heirs, executors, administrators and assigns or any person or persons lawfully\nclaiming or to claim by, from, under or in trust for the DONOR.\n(c) That the said land and premises are free and clear and freely and clearly and absolutely\nand forever released and discharged or otherwise by the DONOR and well and sufficiently\nsaved, kept harmless and indemnified of and from and against all former and other estate,\ntitles, charges and encumbrances whatsoever, had made, executed, occasioned or\nsuffered by the DONOR or by any other person or persons lawfully claiming or to claim by\nfrom, under or in trust for the Donor.\n(d) AND FURTHER that the DONOR and all persons having or lawfully claiming any estate or"
      ],
      "response": "The donor covenants that:\n(a) He has good right, full power, and absolute authority to grant the property as a gift.\n(b) The donee may peaceably and quietly enter upon, occupy, possess, and enjoy the property without any suit, lawful eviction, interruption, claim, or demand from the donor or those claiming under him.\n(c) The property is free and clear of all former estates, titles, charges, and encumbrances.\n(d) The context states \"AND FURTHER that the DONOR and all persons having or lawfully claiming any estate or\", but the covenant is incomplete.",
      "reference": "The donor covenants that: (a) the donor has good right, full power and absolute authority to grant the said piece of land and premises, and the property is free from charges and encumbrances to the government, municipality, or other local authority.",
      "faithfulness": 1.0,
      "answer_relevancy": 0.8940743514949244,
      "context_precision": 0.99999999998,
      "context_recall": 1.0
    },
    {
      "user_input": "What rights does the purchaser have after the sale?",
      "retrieved_contexts": [
        "and undercharged liability in respect of the said property, he shall clear the same and the\nVendee is free there from.\n6. That the Vendor further agrees to indemnify the Vendee and keep him free from disputes if\nany raised or objections made to this conveyance by any one and further should any claim\nbe made or dispute raised at any time of any one in regard to this sale, the vendor hereby\nundertakes that he shall, at his own cost, settle the same and execute or cause to be\nexecuted such further acts, deeds and things as to more fully effectively convey title to the\nproperty hereby sold and conveyed to the Vendee.\n7. That the Vendor also assures the Vendee that if there remains any liability of taxes or rates",
        "property hereby sold and conveyed to the Vendee.\n7. That the Vendor also assures the Vendee that if there remains any liability of taxes or rates\nfor the said property to the Municipal Corporation / Municipality / Village Council or other\nGovernment or statutory authorities upto the date of this conveyance, the Vendor shall clear\nthe same and in case the same are collected from the Vendee, the Vendor shall pay the\nsame to the vendee.\n8. The Vendor further assures and covenants with the Vendee that the Vendee and his heirs\nare entitled to peacefully and absolutely enjoy the said property without any hindrance from\nany person claiming through him or in trust for him.\n9. That the Vendor does hereby put the purchaser in actual physical possession of the",
        "any person claiming through him or in trust for him.\n9. That the Vendor does hereby put the purchaser in actual physical possession of the\nscheduled property on this day. The Vendor further handed over to the purchaser this day\nall the relevant title deeds, documents, and receipts pertaining to the scheduled property,\nwhich are in his or her custody.\n10. That from today onwards the purchaser/vendee shall be entitled to mutate his or her name\nin the land in place of the seller/vendor in Revenue Office by dint of this Sale Deed executed\nby the vendor and shall be entitled to any benefits arising out of the said property including\nany compensation if the land falls under any acquisition proceedings.",
        "11\n(b) That the Purchaser shall quietly possess and enjoy the said property and receive the\nrents, Income and profits thereof without any lawful interruption or disturbance\nwhatsoever by the Vendor or any person or persons lawfully claiming under from or\nthrough him and shall be at liberty to pay there out the Govt. revenue and all other\ncharges of a public nature and all rents if any accruing due in respect of the said\npremises during such possession and any arrears of rent in default of payment of which\nthe said land and premises may be summarily sold and all expenses incurred for the\nmanagement of the said premises and the collection of rents, Income, profits and all\nother outgoing including costs of repairs of the said premises.",
        "2\n1. SALE:\nThe sale deed is the main document by which a seller transfers his right on the property to the\npurchaser, who then acquires absolute ownership of the property. It is also referred to as the\nconveyance deed. On completion of all formalities, a sale deed is prepared. This is the main\ndocument for transfer of ownership of property. The deed is executed by all the parties concerned.\nAll pages of the deed are to be signed. The deed should be witnessed by at least two witnesses giving\ntheir full names, signatures and addresses. The sale deed of immovable property needs compulsory\nregistration at the jurisdictional sub-registrar office.\nGENERAL SALE DEED\nThis deed of sale is made and executed on this \u2026\u2026\u2026\u2026.. day of \u2026\u2026\u2026\u2026\u2026 20...\nBy"
      ],
      "response": "After the sale, the purchaser:\n*   Acquires absolute ownership of the property.\n*   Is entitled to peacefully and absolutely enjoy the property without any hindrance.\n*   Is put in actual physical possession of the property.\n*   Is entitled to mutate their name in the land in the Revenue Office.\n*   Is entitled to any benefits arising out of the property, including compensation if the land falls under acquisition proceedings.\n*   Shall quietly possess and enjoy the property and receive the rents, income, and profits thereof without any lawful interruption or disturbance by the Vendor or any person claiming through him.\n*   Is at liberty to pay government revenue and all other charges of a public nature and any accruing rents.",
      "reference": "The purchaser shall quietly possess and enjoy the property and receive the rents, income and profits thereof without any lawful interruption or disturbance by the vendor or any persons claiming under him.",
      "faithfulness": 1.0,
      "answer_relevancy": 0.9407039833464899,
      "context_precision": 0.99999999998,
      "context_recall": 1.0
    },
    {
      "user_input": "What is the purpose of document registration?",
      "retrieved_contexts": [
        "1\nIntroduction:\nRegistration refers to the recording of the contents of a document with a Registering\nOfficer appointed by the Government. The main purpose of registration is to ensure information\nabout all deals are recorded and maintained apart from giving the document its authenticity. It\ngives information to the people regarding legal rights and obligations arising or affecting a\nparticular property. The registered documents may afterwards be of legal importance, and also\naid in preventing fraud. The process of registering a document is done under the provisions of\nthe Registration Act, 1908. The main objects of the law of registration are \u2013\n(a) to provide a conclusive proof of genuineness of documents;\n(b) to afford publicity of transaction in respect of properties;",
        "draw, approve, present for registration and admit registration of all papers, documents,\ncontracts, agreements, conveyances, mortgage deeds, leases, grants, assurances,\napplications, declarations, trust deeds and other documents as may in any way be required to\nbe so done for or in connection with any movable or immovable property belonging to me or to\nbe acquired by me hereafter or of any part thereof or any interest therein including those held\nby me as owner, lessor, lessee, partner, mortgagor, tenant, trustee or otherwise be interested\nfor the time being including those connected with the management and development of any\nbusiness and also in connection with the sale, purchase, lease, transfer and disposition or",
        "(a) to provide a conclusive proof of genuineness of documents;\n(b) to afford publicity of transaction in respect of properties;\n(c) to prevent fraud;\n(d) to afford facility for ascertaining whether a property has already been dealt with; and\n(e) to afford security of the title deeds and facility of proving titles in case the original\ndeeds are lost or destroyed.\nDocuments generally required for registration\n(a) Duly stamped, signed and executed document.\n(b) Two passport size photos of both parties.\n(c) Two witnesses with valid identification proof & photographs.\n(d) Original Stamp Duty receipt.\n(e) Copy of Power Of Attorney in required cases.\n(f) Proof of identification of each party and witnesses i.e. Election Identity Card,",
        "or property for the time being subject to any trust and all powers and description for the lime\nbeing vested in me as such trustee or as beneficiary as aforesaid or under any deed of trust,\nsettlement or other documents to the extent lawfully possible.\n9. Execution and registration of documents:\n9.1. To execute documents (stocks, shares, annuities):- To execute all deeds and other\ninstruments necessary or proper for transferring any stock, shares, annuities, debentures,\nobligations and other securities held by me or to be acquired by me hereafter to the purchaser\nor purchasers thereof.\n9.2. To execute and register deeds:- To sign, execute, enter into, modify, cancel, alter,\ndraw, approve, present for registration and admit registration of all papers, documents,",
        "(e) Copy of Power Of Attorney in required cases.\n(f) Proof of identification of each party and witnesses i.e. Election Identity Card,\nPassport, identity Card issued by Govt. of India, Semi govt. and Autonomous bodies\nor identification by a Gazetted officer.\n(g) In case the property is/was under a lease from any government authority, then\npermission of lessor for registration of the document.\n(h) NOC from local authorities if the document for registration conveys land converted as\nhouse site without the approval layout.\n(i) Patta transfer application duly filled and signed.\nCompulsory registrable documents:\nSl.No Situation / documents\n1. Instruments of gift of immovable property\n2. Other non-testamentary instruments which purport or operate to create, declare,"
      ],
      "response": "The purpose of document registration is to:\n*   Ensure information about all deals is recorded and maintained.\n*   Give the document authenticity.\n*   Provide information to people regarding legal rights and obligations affecting a property.\n*   Aid in preventing fraud.\n*   Provide conclusive proof of genuineness of documents.\n*   Afford publicity of transactions in respect of properties.\n*   Afford facility for ascertaining whether a property has already been dealt with.\n*   Afford security of title deeds and facility of proving titles if original deeds are lost or destroyed.",
      "reference": "Registration refers to recording the contents of a document with a Registering Officer appointed by the Government. The main purpose is to ensure information about all deals are recorded and maintained, apart from giving the document its authenticity.",
      "faithfulness": 1.0,
      "answer_relevancy": 0.9999744788601423,
      "context_precision": 0.999999999975,
      "context_recall": 1.0
    },
    {
      "user_input": "What are the licensors' representations about the licensed premises?",
      "retrieved_contexts": [
        "13. The Licensors hereby represent and declare that;\n(a) The Licensors are absolutely entitled to the licensed premises;\n(b) The Licensors have not created any charge or encumbrance of whatsoever nature on\nthe said licensed premises nor have they created any tenancy or leave and licence or\nany right in favour of any one in respect of the licensed premises nor shall they create or\npurport to create any such charge or encumbrance hereafter;\n(c) The Licensors have not entered into any Agreement for sale of the licensed premises in\nfavour of any person or party;\n(d) The Licensors has not committed breach of any of the rules regulations.\n14. Any notice required to be given hereunder shall be sufficiently served on the Licensors, if",
        "24\n12. In the event of the Licensee failing to hand over to the Licensors possession of the licensed\npremises on the expiry or sooner determination of the licence hereby granted as hereinabove\nprovided and continues to remain in occupation and possession of the licensed premises,\nthen in that event, notwithstanding the right conferred upon the Licensors, the Licensors shall\ntake such steps as may be advised to take physical possession of the licensed premises.\nThe Licensors shall also be entitled to charge the Licensee compensation for the use and\noccupation of the licensed premises at the rate of Rs. _______ per day, which the Licensee\nagrees and undertakes to pay.\n13. The Licensors hereby represent and declare that;\n(a) The Licensors are absolutely entitled to the licensed premises;",
        "23\n6. The Licensors hereby covenants with the Licensee as follows:-\n(a) To observe and perform all the terms and conditions and stipulations of all documents\nunder which the Licensors derive title to the office premises ;\n(b) To permit the Licensee to use and occupy the licensed premises without any hindrance\nor obstruction of any nature whatsoever as long as the Licensee pays the licence fee\nand or compensation as hereinabove provided and observes and performs all the terms,\nconditions and covenants contained;\n(c) To permit the Licensee to install further furniture and fixtures in the licensed premises in\norder to suit to its purpose;\n(d) To permit the Licensee to carry out all the requisite repairs to the licensed premises",
        "absolutely entitled to use, occupy, possess and enjoy the said premises: AND WHEREAS the\nLicensee has approached the Licensors and has requested the Licensors to let out to it, the\nLicensee, the said premises on leave and licence basis, which the Licensors have agreed to do\non certain terms and conditions mutually agreed upon by and between them : AND WHEREAS\nthe parties hereto are desirous of recording the said terms and conditions :",
        "21\nNOW THIS AGREEMENT TO LEAVE AND LICENCE WITNESSETH AND IT IS HEREBY\nAGREED BY AND THE PARTIES HERETO as under: -\n1. The Licensors shall grant unto the Licensee and the Licensee hereby accepts from the\nLicensors a licence to use and occupy the office premises bearing No. ____ on the ____\nfloor of the building known as ____________ , save and except one cabin in the said\npremises (hereinafter called \"the licensed premises\") situate lying and being at\n(____________ road) on leave and license basis.\n2. The duration of the licence hereby granted shall be for a period of two years only\ncommencing from the date the Licensors puts the Licensee in possession of the licensed\npremises.\n3. In consideration of the Licensors permitting the Licensee to use and occupy the licensed"
      ],
      "response": "The licensors represent and declare that:\n*   They are absolutely entitled to the licensed premises.\n*   They have not created any charge or encumbrance, tenancy, leave and licence, or any right in favor of anyone on the licensed premises, nor shall they create any such charge or encumbrance hereafter.\n*   They have not entered into any agreement for sale of the licensed premises.\n*   They have not committed a breach of any rules or regulations.",
      "reference": "The licensors represent that: (a) they are absolutely entitled to the licensed premises, and (b) they have not created any charge or encumbrance of whatsoever nature on the premises nor have they created any tenancy or leave and licence.",
      "faithfulness": 1.0,
      "answer_relevancy": 0.9549059159002334,
      "context_precision": 0.99999999998,
      "context_recall": 1.0
    },
    {
      "user_input": "How is the trust settlement done?",
      "retrieved_contexts": [
        "agreed to act as Trustees of the Trust, proposed by the party of the first part.\nAND WHEREAS nothing contained in this deed shall be deemed to authorize the trustees to do\nany act which may in any way be construed statutory modifications thereof and all activities of\nthe trust shall be carried out with a view to benefit the public at large, without any profit motive\nand in accordance with the provisions of the Income Tax Act, 1961.\nAND WHEREAS the trust is hereby expressly declared to be a public charitable trust and all the\nprovisions of this deed are to be constituted accordingly.\nNOW THIS DEED OF TRUST WITNESSTH AS FOLLOWS:\n1. Settlement:\nThe party of the first part, the SETTLOR, does hereby settle the sum of Rs._______ /-",
        "NOW THIS DEED OF TRUST WITNESSTH AS FOLLOWS:\n1. Settlement:\nThe party of the first part, the SETTLOR, does hereby settle the sum of Rs._______ /-\n(Rs. __________ only) in Trust, with the name and for the objects hereinafter stated, by\ndelivering the said amount in cash which the party of the other part, the Trustees, have",
        "28\n7. TRUST DEED:\nThe instrument by which the trust is declared is called instrument of Trust, and is\ngenerally known as Trust Deed. A written trust-deed is always desirable, even if not required\nstatutorily.\nDEED OF TRUST\nTHIS DEED OF TRUST executed at _______on this _________day of_________20 ____,\nBETWEEN\n_____________________________ (Party of the first part) hereinafter called\n\"SETTLOR\u201d OF THE ONE PART\nAND\n1. _________________ S/O. ________________, residing at ____________ &\n2. __________________S/O. ________________, residing at ____________ &\n3. SMT. W/O SHRI. , of ____________\n(Hereinafter called \" The Trustees\" which expression shall unless repugnant to the context or\nmeaning thereof be deemed to include the survivors or survivor of them and the trustees or",
        "expenses incurred in the upkeep or management thereof.\n(d)That the trustees shall receive and hold the income of the trust on behalf of and for the\nbenefit of the beneficiaries under the trust.\n9. Number of Trustees and their Term:\nThe Trust will be managed by a Board of Trustees consisting of not less than 2 trustees\nand not more than 9 trustees. The parties of the Other Part will be First Trustees and they shall\nautomatically form the Board of Trustees.\nThe first Managing Trustee shall be the SETTLOR and he will hold office for his life time. After\nthe demise or relinquishment of office of the Managing Trustee or in the event of the first\nManaging Trustee failing to nominate his successor in office, the remaining trustees shall elect\none of the other Trustees as Managing Trustee.",
        "permission of the court vide dated _______, a copy of which is annexed hereto.\n4. The ceremony of giving and taking in adoption has been duly performed on ________ along\nwith other religious ceremonies.\nNOW I, ____________, hereby declare I have adopted the said child as my\nson/daughter and the said child shall have, from the date of adoption, all the legal rights and\nliabilities of my adopted son/ daughter.\nIN WITNESS WHEREOF, I am signing this deed this ___________ day of\n______________.\nWITNESS:\n1. Sh.______________\n2.\n16. SETTLEMENT:\nFAMILY SETTLEMENT BETWEEN THE HEIRS OF A DECEASED\nThis Deed of Family Settlement made at ......... on this ........... day of ......... 20\u2026,\nbetween the heirs of \u2026\u2026\u2026\u2026.. (deceased) namely"
      ],
      "response": "The trust settlement is done by the SETTLOR (party of the first part) who settles a specific sum of money in Trust by delivering the said amount in cash to the Trustees (party of the other part).",
      "reference": "The settlor settles a sum of money in trust, with the name and for the objects stated in the deed, by delivering the said amount in cash to the other party.",
      "faithfulness": 1.0,
      "answer_relevancy": 0.9306377639022307,
      "context_precision": 0.99999999995,
      "context_recall": 1.0
    },
    {
      "user_input": "What are the duties of the Vice President of the trust?",
      "retrieved_contexts": [
        "(b) Vice President \u2013\nThe Vice President shall discharge the duties of the Managing Trustee, in the\nabsence of the Managing Trustee of the Trust and shall have the power and authority\ndelegated and assigned to him/her by the Managing Trustee.\n(c) Secretary\nThe Secretary shall maintain the records of the trust, prepare and circulate\nagenda for Board of Trustees\u2019 meeting for the approval of the Managing Trustee and\nalso prepare the minutes of the Board meeting. The Secretary shall be also responsible\nfor the day to day administrative activities of the Trust. The Secretary shall deal with\ncorrespondence received by the Trust, send replies in consultation with the Managing\nTrustee, Vice President and/or the Treasurer wherever necessary. He/she will be",
        "33\nManaging Trustee shall have all the residuary powers, not explicitly assigned to any of\nthe other officers in these presents. The Managing Trustee is authorized to sign along\nwith the Treasurer, bank cheques, deposit release vouchers etc. The Managing Trustee\nis empowered to remove any Trustee from the Trust and its offices, if he finds that\nhis/her activities are not congenial to the activities of the Trust. The Managing Trustee is\nresponsible for ensuring that the Trust pursues its Objects and for maintaining the dignity\nof the Trust organization and shall use his influence to promote the activities of the Trust.\n(b) Vice President \u2013\nThe Vice President shall discharge the duties of the Managing Trustee, in the",
        "amongst themselves for each of the offices of Vice President, Secretary and\nTreasurer. The term of office for Vice President, Secretary and Treasurer shall be for\na period of one year from their date of appointment and they may be re-elected for\nfurther terms. No Trustee including the Managing Trustee shall hold more than one of\nthe above offices at the same time. The persons holding these offices of Vice\nPresident, Secretary and Treasurer shall be under the administrative guidance and\nsupervision of the Managing Trustee and will report to him directly.\n11. Roles and Responsibilities:\nThe Roles, Responsibilities and powers of all the officers are detailed below. In addition\nto these, the Managing Trustee may grant additional roles, responsibilities and powers to any of\nthe Trustees.",
        "fund / property.\n(n) The Trustees shall hold honorary office and shall not be entitled to any Salary,\nallowances or perquisites, except for the reimbursement of actual expenses incurred\nin connection with attending to the Trust matters.\n(o) The Board of Trustees will follow the instructions given by any donor who makes\nsubstantial contribution towards furtherance of the objects of the Trust, so long as\nsuch instructions are not detrimental to the attainment of the objects of the Trust and\nare in conformity with the provisions of the Income-tax Act, 1961.\n(p) For the management and administration of the Trust, the Trustees shall elect one\namongst themselves for each of the offices of Vice President, Secretary and",
        "Trustee, Vice President and/or the Treasurer wherever necessary. He/she will be\nresponsible for the safe custody of all the properties and records of the Trust. The\nSecretary shall represent the Trust in all legal matters, sign the papers related to legal\ncases, attend to courts or represent the Trust in Government offices.\n(d) Treasurer\nThe Treasurer will prepare Annual Budget, monthly and yearly expenditure\nstatements get the expenditure audited by auditor duly appointed by the Board of\nTrustees and place them before the Board of Trustees for approval. The Treasurer is\nresponsible to maintain cash book and prepare vouchers for the payments made,\nreceive contributions, sign acknowledgements for the amounts or articles received by the"
      ],
      "response": "The Vice President shall discharge the duties of the Managing Trustee in the absence of the Managing Trustee of the Trust, and shall have the power and authority delegated and assigned to him/her by the Managing Trustee.",
      "reference": "The Vice President shall discharge the duties of the Managing Trustee in the absence of the Managing Trustee and shall have the power and authority delegated and assigned by the Managing Trustee.",
      "faithfulness": 1.0,
      "answer_relevancy": 0.9255220943107484,
      "context_precision": 0.999999999975,
      "context_recall": 1.0
    },
    {
      "user_input": "What happens to the original deed of partition?",
      "retrieved_contexts": [
        "constitute each party to this deed the sole and absolute owner of demands of other thereto\nor concerning therewith, as from the date of this deed.\n2. That the original deed of partition shall be retained by first party, at true copy thereof signed\nby each party has been delivered to the other said parties who shall be entitled to require\nproduction of the original from the first party before any Court or public office or Bank or\nInsurance Company etc. if so desired.\n3. That the parties have agreed that all taxes and public charges in respect of the allotted\nproperties shall be borne by the parties themselves.",
        "43\n4. That each party will execute such deed or do all other acts necessary which may be\nrequisite for more effectually assuring the party so requiring and at his cost, in the manner\nrequired by law and appear before revenue or other authorities to have mutation effected in\nrespect of the party assigned to the party concerned.\n5. That the valuation of the entire property under this partition-deed is fixed at Rs.__________.\nIN WITNESS WHEREOF the aforesaid parties have signed this deed of partition on the\nday and year first before written.\nWitnesses :\n1\u2026\u2026\u2026\u2026\u2026\u2026\u2026\u2026\u2026..\n2\u2026\u2026\u2026\u2026\u2026\u2026\u2026\u2026\u2026..\nSd/-\n1. First party\n2. Second party\n3. Third party\nSchedule-1\nSchedule-2\nSchedule-3\n10. RELINQUISHMENT / RELEASE:\nRelinquishment / release is one of the modes of transfer of property. By way of",
        "42\nDEED OF PARTITION BETWEEN CO-OWNERS\nShri\u2026\u2026.s/o\u2026\u2026\u2026r/o\u2026\u2026\u2026\u2026\u2026\u2026\u2026\u2026.. (hereinafter called the First Party), and Shri\n\u2026\u2026\u2026..s/o\u2026\u2026\u2026\u2026\u2026\u2026 r/o \u2026\u2026\u2026\u2026\u2026\u2026.. (hereinafter called the Second Party) and\nShri\u2026\u2026.s/o\u2026\u2026\u2026r/o\u2026\u2026\u2026\u2026\u2026\u2026\u2026 (hereinafter called the Third Party) do hereby\nexecute this DEED OF PARTITION between themselves on this \u2026\u2026\u2026\u2026\u2026\u2026. day of\n\u2026\u2026\u2026\u2026\u2026\u2026\nWHEREAS the aforesaid parties are the co-owners in equal shares of the properties\nmentioned in the Schedules 1, 2, and 3 of this deed of partition.\nWHEREAS the aforesaid properties were purchased by the aforesaid parties\non\u2026\u2026\u2026\u2026.from\nShri\u2026\u2026\u2026\u2026\u2026\u2026\u2026\u2026 s/o \u2026\u2026\u2026\u2026\u2026\u2026. r/o \u2026\u2026\u2026\u2026\u2026\u2026\u2026\u2026\u2026. vide sale-deed\ndated\u2026\u2026..and registered on\u2026\u2026\u2026\u2026\nAND WHEREAS the aforesaid parties have mutually agreed to divide the said properties",
        "duplicate, duly signed and stamped shall be retained by the Party of the Other Part and shall\nfor all purposes be treated as the original.\nIN WITNESS WHEREOF the parties hereto have hereunto set and subscribed their\nrespective hands and seals the day and year first hereinabove written.\nFIRST SCHEDULE\n(Description of property of the Party of the One Part)\nSECOND SCHEDULE\n(Description of property of the Party of the Other Part)\nSigned, Sealed and Delivered }\nby the within named ________ }\nin the presence of ___________ }\nSigned, Sealed and Delivered }\nby the within named __________ }\nin the presence of ____________\n12. CANCELLATION:\nCANCELLATION DEED\n(Where money transaction has taken place)\nThis deed of cancellation made this......... day of......... 20\u2026 between \u2026\u2026\u2026\u2026 (hereinafter",
        "49\n(4) That in the event of any defect in title or any disturbance of possession by the other\nor those claiming through or under him, this transaction shall be null and void and the\nparties hereto shall be relegated to the same position in which they were prior to this\ntransaction.\n4. That the part of the One Part has paid on or before the execution of this Deed a sum of\nRs.____________ (Rupees ______________ only) by cheque to the party of the Other Part\n(the receipt whereof has separately been acknowledged by the party of the Other Part).\n5. The original Deed of Exchange shall be retained by the Party of the One Part and the\nduplicate, duly signed and stamped shall be retained by the Party of the Other Part and shall\nfor all purposes be treated as the original."
      ],
      "response": "The original deed of partition shall be retained by the first party.",
      "reference": "The original deed of partition shall be retained by the first party, and a true copy thereof signed by each party has been delivered to the other party.",
      "faithfulness": 1.0,
      "answer_relevancy": 0.9345125310345804,
      "context_precision": 0.8874999999778125,
      "context_recall": 1.0
    },
    {
      "user_input": "What power does the attorney have regarding notices to tenants?",
      "retrieved_contexts": [
        "2.5. To serve notice on tenants:- To sign and give any notice to any occupier of any\nproperty belonging to me to quit or to repair or to abate any nuisance or to remedy any breach\nof covenant or for any other purpose whatsoever.\n2.6. To construct, repair and/or reconstruct:- To take down, demolish, rebuild and/or\nrepair any of my house, building or other structure of whatever nature.\n2.7. To get utilities: - To apply for and obtain electricity, gas, water, sewerage and/or\nconnections of any utilities and/or to make alterations and/or close down and/or have\ndisconnected the same in my properties.\n2.8. To view the condition of any property:- To enter upon any of my property or any part\nof it as often as be desired to view the state of repair thereof and to require any occupier as a",
        "fees, maintenance charges, electricity charges, corporation taxes and all other sums of moneys\nreceivable in respect of my properties and to make all just and reasonable allowance therein in\nrespect of rates, taxes, repairs and other outgoings and to take all necessary steps whether by\naction, distress or otherwise to recover any property or sums of money in arrears.\n2.4. To pay outgoings:- To pay all taxes, rates, assessments, charges, expenses and\nother outgoings whatsoever payable for or on account of my properties or any part thereof and\nto insure any buildings thereon against loss or damage by fire and other risks as be deemed\nnecessary and/or desirable and to pay all premia for such insurances.\n2.5. To serve notice on tenants:- To sign and give any notice to any occupier of any",
        "date of the receipt of such notice.\n(b) If at any time the dwelling house or the furniture or any part thereof shall be rendered\nunfit for occupation or use by reason of any damage; not due to default of the tenant, the\nlandlord shall reinstate the same at his own expenses and with all convenient speed.\n5. Until the Landlord and the tenant shall otherwise advise each other in writing, their addresses\nfor service of all notices and other communications shall be as under:\n(a) For the Landlord: \u2026\u2026\u2026\u2026\u2026\u2026\u2026\u2026\u2026\u2026\u2026\u2026\u2026\u2026\u2026\u2026\n(b) For the Tenant: \u2026\u2026\u2026\u2026\u2026\u2026\u2026\u2026\u2026\u2026\u2026\u2026\u2026\u2026\u2026\u2026\u2026\u2026\u2026\u2026\u2026\n6. This Lease Deed shall be executed in duplicate. The original shall be retained by the\nLandlord and the duplicate by the tenant.\n7. The stamp duty and all other expenses in respect of this Lease Deed and duplicate thereof",
        "of it as often as be desired to view the state of repair thereof and to require any occupier as a\nresult of such view to remedy any want of repair or abate any nuisance.\n2.9. To enforce covenants:- To enforce any covenant in any lease, licence or tenancy\nagreement or any other document affecting any of my property and if any right to re-enter arises\nin any manner under such covenants or under notice to quit, then to exercise such rights\namongst others.\n2.10. To deal with trespassers:- To warn off and prohibit and if necessary proceed\nagainst in due form of law against all trespassers on any of my property and to take appropriate\nsteps whether by action or otherwise and to abate all nuisances.\n2.11. To prepare and have sanctioned the plans: - To get prepared plans for construction",
        "do hereby appoint ----------------, s/o ------------------, residing at ----------------------- to be my Attorney\nfor me and in my name and on my behalf.\n1. To negotiate and sell my property situated at ----------------- to any purchaser at such price and at\nsuch time as my said Attorney may in his absolute discretion think proper to agree upon and for\nsuch purpose to execute any document, deed or other papers and to present the same for\nregistration and to admit the execution thereof."
      ],
      "response": "The attorney has the power to sign and give any notice to any occupier of the property to quit, repair, abate any nuisance, remedy any breach of covenant, or for any other purpose whatsoever.",
      "reference": "The attorney has the power to sign and give any notice to any occupier of any property to quit, to repair, to abate any nuisance, to remedy any breach of covenant, or for any other purpose whatsoever.",
      "faithfulness": 1.0,
      "answer_relevancy": 0.9378905682596782,
      "context_precision": 0.8874999999778125,
      "context_recall": 1.0
    },
    {
      "user_input": "What is the liability of the transferor in case of loss?",
      "retrieved_contexts": [
        "of the transferee, we shall be liable to make good loss jointly as well as severally which may\nbe sustained by the \u2026\u2026\u2026\u2026.. or its employees on account of this transfer out of our\nproperty both moveable and immoveable.",
        "the\u2026\u2026\u2026.. (hereinafter referred to as the Board) of the other part.\nWhereas \u2026\u2026\u2026\u2026\u2026\u2026.. , allottee of \u2026\u2026\u2026\u2026. , is willing to get the allotment of the said house\nat his/her own in the name of \u2026\u2026\u2026 and this transfer is a friendly transfer.\nWhereas \u2026\u2026\u2026\u2026\u2026\u2026\u2026. has agreed to transfer the allotment of \u2026\u2026\u2026\u2026.. in favour of\n\u2026\u2026\u2026\u2026\u2026\u2026\u2026\u2026..\nAnd whereas \u2026\u2026\u2026\u2026. has asked the transferor to furnish deed of Indemnity from two\nindependent persons of means for the transfer of the same.\nNOW THIS DEED OF INDEMNITY WITNESSETH AS UNDER:-\n1. That the said transfer which is being effected in the name of \u2026\u2026\u2026\u2026.. is a friendly transfer\nand in case \u2026\u2026\u2026.. would suffer any loss whatsoever on account of this transfer in the name\nof the transferee, we shall be liable to make good loss jointly as well as severally which may",
        "20. Dissolution:\nIn the event of dissolution or winding up of the Trust the assets remaining as on the date\nof dissolution shall under no circumstances be distributed amongst the Trustees but the same\nshall be transferred to some other similar Trust/Organisation whose objects are similar to those\nof this Trust with the permission of the Charity Commissioner / Court / any other law as may be\napplicable for the time being. The Trustees shall be indemnified against all losses and liabilities\nincurred by them in the execution of the Trust and shall have a lien over the funds and\nproperties of the Trust for such indemnity.\nSCHEDULE\nAt present, the Trust has no property or assets, either movable or immovable, other than the",
        "(2) That the property hereby transferred by him and the rent and profits thereof shall be\nquietly enjoyed by the transferee without disturbance or interruption whatsoever;\n(3) That at the request and cost of the other party, the parties hereto shall execute such\nassurance and do such acts, deeds and tings as shall be reasonably necessary for\nthe more perfectly assuring unto such other the title to the property hereby\ntransferred; and",
        "and undercharged liability in respect of the said property, he shall clear the same and the\nVendee is free there from.\n6. That the Vendor further agrees to indemnify the Vendee and keep him free from disputes if\nany raised or objections made to this conveyance by any one and further should any claim\nbe made or dispute raised at any time of any one in regard to this sale, the vendor hereby\nundertakes that he shall, at his own cost, settle the same and execute or cause to be\nexecuted such further acts, deeds and things as to more fully effectively convey title to the\nproperty hereby sold and conveyed to the Vendee.\n7. That the Vendor also assures the Vendee that if there remains any liability of taxes or rates"
      ],
      "response": "In the context of a sale, the Vendor (transferor) agrees to indemnify the Vendee (transferee) and keep them free from disputes or objections, settling any claims at the Vendor's own cost. The Vendor is also liable to clear any remaining taxes or rates and undercharged liability in respect of the said property.\n\nIn the context of a friendly transfer where a deed of indemnity is furnished by two independent persons, \"we\" (the indemnifiers) shall be liable to make good loss jointly as well as severally. The context does not explicitly state the direct liability of the transferor in this specific scenario, only that the transferor was asked to furnish the deed of indemnity.",
      "reference": "The transferor shall be liable to make good any loss, jointly as well as severally, which may be sustained by the transferee or its employees on account of the transfer, out of their property both moveable and immoveable.",
      "faithfulness": 0.875,
      "answer_relevancy": 0.7779550560251494,
      "context_precision": 0.8874999999778125,
      "context_recall": 1.0
    },
    {
      "user_input": "What duties does the Secretary of the trust have?",
      "retrieved_contexts": [
        "(b) Vice President \u2013\nThe Vice President shall discharge the duties of the Managing Trustee, in the\nabsence of the Managing Trustee of the Trust and shall have the power and authority\ndelegated and assigned to him/her by the Managing Trustee.\n(c) Secretary\nThe Secretary shall maintain the records of the trust, prepare and circulate\nagenda for Board of Trustees\u2019 meeting for the approval of the Managing Trustee and\nalso prepare the minutes of the Board meeting. The Secretary shall be also responsible\nfor the day to day administrative activities of the Trust. The Secretary shall deal with\ncorrespondence received by the Trust, send replies in consultation with the Managing\nTrustee, Vice President and/or the Treasurer wherever necessary. He/she will be",
        "Trustee, Vice President and/or the Treasurer wherever necessary. He/she will be\nresponsible for the safe custody of all the properties and records of the Trust. The\nSecretary shall represent the Trust in all legal matters, sign the papers related to legal\ncases, attend to courts or represent the Trust in Government offices.\n(d) Treasurer\nThe Treasurer will prepare Annual Budget, monthly and yearly expenditure\nstatements get the expenditure audited by auditor duly appointed by the Board of\nTrustees and place them before the Board of Trustees for approval. The Treasurer is\nresponsible to maintain cash book and prepare vouchers for the payments made,\nreceive contributions, sign acknowledgements for the amounts or articles received by the",
        "fund / property.\n(n) The Trustees shall hold honorary office and shall not be entitled to any Salary,\nallowances or perquisites, except for the reimbursement of actual expenses incurred\nin connection with attending to the Trust matters.\n(o) The Board of Trustees will follow the instructions given by any donor who makes\nsubstantial contribution towards furtherance of the objects of the Trust, so long as\nsuch instructions are not detrimental to the attainment of the objects of the Trust and\nare in conformity with the provisions of the Income-tax Act, 1961.\n(p) For the management and administration of the Trust, the Trustees shall elect one\namongst themselves for each of the offices of Vice President, Secretary and",
        "receive contributions, sign acknowledgements for the amounts or articles received by the\nTrust and prepare monthly and yearly statements of revenue and expenditure, as well\nas, the register of assets of the Trust and place them before the Board of Trustees for\ntheir approval. The Treasurer is authorized to sign bank cheques, application for drafts\nand payment instructions jointly with the Managing Trustee and draw money from the\nbank, upto the limits defined by the Board of Trustees in their meetings. The Treasurer is\nresponsible for safe custody of cash, bonds, securities etc. of the Trust.\n12. Meeting of the Board of Trustees:\nThe Board of Trustees should meet atleast once in every calendar quarter and may meet\nmore often when required.",
        "amongst themselves for each of the offices of Vice President, Secretary and\nTreasurer. The term of office for Vice President, Secretary and Treasurer shall be for\na period of one year from their date of appointment and they may be re-elected for\nfurther terms. No Trustee including the Managing Trustee shall hold more than one of\nthe above offices at the same time. The persons holding these offices of Vice\nPresident, Secretary and Treasurer shall be under the administrative guidance and\nsupervision of the Managing Trustee and will report to him directly.\n11. Roles and Responsibilities:\nThe Roles, Responsibilities and powers of all the officers are detailed below. In addition\nto these, the Managing Trustee may grant additional roles, responsibilities and powers to any of\nthe Trustees."
      ],
      "response": "The Secretary shall maintain the records of the trust, prepare and circulate the agenda for Board of Trustees\u2019 meetings for the approval of the Managing Trustee, and prepare the minutes of the Board meeting. The Secretary is also responsible for the day-to-day administrative activities of the Trust, dealing with correspondence, and sending replies in consultation with the Managing Trustee, Vice President, and/or Treasurer where necessary. Additionally, the Secretary is responsible for the safe custody of all properties and records of the Trust, representing the Trust in all legal matters, signing papers related to legal cases, and attending courts or representing the Trust in Government offices.",
      "reference": "The Secretary shall maintain the records of the trust.",
      "faithfulness": 1.0,
      "answer_relevancy": 0.9516458723681057,
      "context_precision": 0.7555555555303703,
      "context_recall": 1.0
    },
    {
      "user_input": "What can the attorney do with bills of exchange?",
      "retrieved_contexts": [
        "or firms or business or businesses or in my capacity as trustee or beneficiary of any trust with\nany bank or banks including Postal Savings Bank.\n5.2. Drawing and negotiations of cheques: - To draw, sign, negotiate and/or endorse\ncheques, payment orders, drafts, dividend warrants and/or any other instruments and to\nexecute, enter into, acknowledge, do and present all such deeds, instruments, contracts,\nagreements, acts, deeds and things as shall be requisite or deemed fit and proper for or in\nrelation to all or any of the purposes, matters or things herein contained or others with any bank\nor banks.\n5.3. To deal with bills of exchange:- For all or any of the banking purposes to draw,\naccept, endorse, discount or otherwise deal with any bills of exchange, bills of lading, delivery",
        "45\n11. EXCHANGE:\nWhen two persons mutually transfer the ownership of one thing for the ownership of\nanother, neither thing nor both things being money only, the transaction is called an Exchange.\nA transfer of property in completion of an exchange can be made only in the manner provided\nfor the transfer of such property by sale. The difference between a sale and an exchange is that\nin a sale the price is paid in money while in an exchange it is paid in another property by way of\nbarter. Sale is always for a price, which means money or the current coin of the realm while no\nprice is paid in an exchange, there being only a transfer of one specific property for another.\nEXCHANGE DEED\n(Simple deed of exchange where the value of properties are of the same value)",
        "advance and to vary such rates of interests or consideration from lime to time.\n6.3.2. To remit, reduce or settle any claim of any moneys, losses and/or damages.\n6.3.3. To draw, execute, negotiate, cancel, present for payment and/or make or receive\npayment of any promissory note, bill of exchange, bond or undertaking regarding any money\nreceipt and/or advance.\n7. Representations:\n7.1. To represent before bank or banks, insurance companies, etc:- To represent me or\nany of my firm or firms or business in any of the bank or banks, insurance companies, courts,\nregistration offices, municipal offices, office of competent authority, urban land ceiling, post\noffices, sales tax offices, income-tax offices, customs offices, revenue offices or any co-",
        "do hereby appoint ----------------, s/o ------------------, residing at ----------------------- to be my Attorney\nfor me and in my name and on my behalf.\n1. To negotiate and sell my property situated at ----------------- to any purchaser at such price and at\nsuch time as my said Attorney may in his absolute discretion think proper to agree upon and for\nsuch purpose to execute any document, deed or other papers and to present the same for\nregistration and to admit the execution thereof.",
        "56\nexecute, sign and register mortgage, charges, transfer and/or give other security or securities\nby any other deed or deeds on such terms and conditions as my said attorney or his substitute\nor substitutes may think fit and proper.\n6.2. Loans and advances:- To make and/or to receive any loan or advance from any\nbank, financial institution or other person to such extent and on such terms as the said attorney\nmay deem expedient and also to secure the same by pledging, hypothecating, mortgaging,\ncharging or any other manner encumbering any of my movable or immovable property.\n6.3 Miscellaneous:\n6.3.1. To agree to charge or pay any interest or other considerations for any loan and/or\nadvance and to vary such rates of interests or consideration from lime to time."
      ],
      "response": "The attorney can draw, execute, negotiate, cancel, present for payment, and/or make or receive payment of any bill of exchange regarding any money receipt and/or advance.",
      "reference": "The attorney can accept, endorse, discount or otherwise deal with any bills of exchange, bills of lading, delivery orders, promissory notes or other mercantile instruments relating to money, goods, properties or otherwise.",
      "faithfulness": 0.8888888888888888,
      "answer_relevancy": 0.95198987356871,
      "context_precision": 0.8055555555287036,
      "context_recall": 1.0
    },
    {
      "user_input": "What is the attorney's power regarding bank lockers?",
      "retrieved_contexts": [
        "accept, endorse, discount or otherwise deal with any bills of exchange, bills of lading, delivery\norders, promissory notes or other mercantile instruments relating to money, goods, properties\nor otherwise.\n5.4. To operate bank locker or safe deposit vault locker: - To operate any bank locker or\nsafe deposit vault locker and to deposit therein and withdraw therefrom any articles belonging to\nme.\n6. Money:\n6.1. To realise loans or borrow money:- To realise loans and/or borrow money from time\nto time from any bank, institution, or any person or persons, organisation whatsoever against\nthe security or properties both movable and immovable belonging to me or any of my firm or\nfirms of business or businesses in which I am now or may hereafter become interested and to",
        "any statutory body, shares, stocks or debentures in any such company, corporation or body as\naforesaid or other stocks, funds, debentures and securities of any and every description\nwhatsoever or any other properties.\n5. Banking\n5.1. Banking operation:- To open, operate, continue or close any account including any\noverdraft or other loan account and/or saving account, current, fixed or other accounts and also\nsafe deposit lockers and all accounts whatsoever in my name and on my behalf with any bank\nor banks that may be existing or may in future be opened in my name or in the name of my firm\nor firms or business or businesses or in my capacity as trustee or beneficiary of any trust with\nany bank or banks including Postal Savings Bank.",
        "advance and to vary such rates of interests or consideration from lime to time.\n6.3.2. To remit, reduce or settle any claim of any moneys, losses and/or damages.\n6.3.3. To draw, execute, negotiate, cancel, present for payment and/or make or receive\npayment of any promissory note, bill of exchange, bond or undertaking regarding any money\nreceipt and/or advance.\n7. Representations:\n7.1. To represent before bank or banks, insurance companies, etc:- To represent me or\nany of my firm or firms or business in any of the bank or banks, insurance companies, courts,\nregistration offices, municipal offices, office of competent authority, urban land ceiling, post\noffices, sales tax offices, income-tax offices, customs offices, revenue offices or any co-",
        "56\nexecute, sign and register mortgage, charges, transfer and/or give other security or securities\nby any other deed or deeds on such terms and conditions as my said attorney or his substitute\nor substitutes may think fit and proper.\n6.2. Loans and advances:- To make and/or to receive any loan or advance from any\nbank, financial institution or other person to such extent and on such terms as the said attorney\nmay deem expedient and also to secure the same by pledging, hypothecating, mortgaging,\ncharging or any other manner encumbering any of my movable or immovable property.\n6.3 Miscellaneous:\n6.3.1. To agree to charge or pay any interest or other considerations for any loan and/or\nadvance and to vary such rates of interests or consideration from lime to time.",
        "57\nAssurances, Metropolitan Magistrate and other officer or officers or authority having\njurisdiction and to acknowledge and register or have registered and perfected all deeds,\ninstruments and writings, executed, signed or made by me personally or as partner of\nany firm or firms or business or businesses or by my said attorneys or any of them by\nvirtue of the powers herein conferred.\n8. Trusts:\n8.1. To execute trusts:- To do all acts, deeds relating to any matter in which I am a\ntrustee and/or beneficiary and to exercise all powers and authorities elsewhere hereunder or\notherwise as expedient.\n8.2. To exercise powers:- To execute and exercise in relation to any land or investment\nor property for the time being subject to any trust and all powers and description for the lime"
      ],
      "response": "The attorney has the power to operate any bank locker or safe deposit vault locker, including opening, continuing, or closing them, and to deposit therein and withdraw therefrom any articles belonging to the principal.",
      "reference": "The attorney has the power to operate any bank locker or safe deposit vault locker.",
      "faithfulness": 0.8333333333333334,
      "answer_relevancy": 0.9517177834225278,
      "context_precision": 0.9999999999666667,
      "context_recall": 1.0
    }
  ]
}